{"schema_version":"1","target":{"claim_id":"penetration-table-2","source_anchor":{"kind":"table","locator":"Table 2"},"category":"reported-numeric-result","description":"Maximum penetration result"},"reproduction_mode":"artifact-rerun","artifact":{"name":"authors-code","commit":"abc123"},"inventory_hashes":{"archive":"abcdef"},"environment":{"os":"Linux"},"commands":["python run.py"],"inputs":{"scene":"stack"},"expected_results":[{"claim_id":"penetration-table-2","result_type":"numeric-measurement","metric":"maximum penetration","expected":0.9,"unit":"mm"}],"observed_results":[{"claim_id":"penetration-table-2","result_type":"numeric-measurement","metric":"maximum penetration","observed":0.8,"outcome":"within-tolerance","evidence_path":"results/table2.json","unit":"mm"}],"tolerances":{"absolute":0.1},"patch_log":["none"],"deviations":["none"],"evidence_paths":["results/table2.json"],"status":"pass"}
