{
  "schema_version": "1",
  "target": {
    "claim_id": "table-3-cityflood-speedup",
    "source_anchor": {
      "kind": "table",
      "locator": "Table 3, CityFlood"
    },
    "category": "reported-performance-result",
    "description": "FastFluid relative to ReferenceFluid reaches the reported 1.8x performance speedup in CityFlood while maintaining the paper's same-quality condition"
  },
  "reproduction_mode": "artifact-rerun",
  "artifact": {
    "name": "authors-fastfluid.zip (unverified filename only; no artifact acquired)",
    "commit": "unverified: no commit, tag, authoritative URL, or archive digest supplied"
  },
  "inventory_hashes": {
    "archive_sha256": "unavailable: archive not supplied or acquired",
    "archive_size_bytes": "unavailable: archive not supplied or acquired",
    "source_commit_or_tag": "unavailable: no authoritative source revision supplied",
    "extracted_inventory": "unavailable: no artifact was extracted or inventoried"
  },
  "environment": {
    "execution_state": "not constructed: acquisition, provenance, license, inputs, and scientific environment are unresolved",
    "scientific_environment": "unavailable: OS or image digest, compiler or interpreter, dependency lock, hardware, driver or CUDA, precision, locale, and environment variables were not supplied",
    "isolation_requirement": "disposable uncredentialed VM or dedicated least-privilege runner; non-root; network disabled during execution; immutable read-only original artifact; one narrow writable output; dropped capabilities; no-new-privileges; seccomp or MAC policy; bounded CPU, memory, processes, disk, wall time, and devices",
    "forbidden_exposure": "host credentials or tokens, SSH material or agent, home directories, Docker socket, privileged mode, host networking, host namespaces, unrestricted devices, and unrelated files",
    "network_policy": "artifact acquisition and any later result upload each require separate explicit approval; author code execution remains network-disabled"
  },
  "commands": [
    "BLOCKED, NOT RUN: acquisition command unavailable because no authoritative URL, license, archive identity, or explicit network approval was supplied",
    "BLOCKED, NOT RUN: inventory command unavailable because no immutable local original-artifact root exists",
    "BLOCKED, NOT RUN: environment, build, smoke, target, and comparison commands unavailable because the artifact, dependency locks, image digest, exact inputs, metric definitions, and run parameters are unpinned",
    "EXECUTED: python scripts/validate_research_artifact.py reproduction-run tests/fixtures/manifests/reproduction-run-task28-enabled-attempt-2.json"
  ],
  "inputs": {
    "scene": "CityFlood named by the claim, but exact scene files and hashes are unavailable",
    "assets_and_initial_state": "unavailable",
    "seed": "unavailable; no default selected",
    "simulation_parameters": "unavailable: timestep, horizon, resolution or budget, precision, warm-up, synchronization, repetitions, and timed boundary are unspecified",
    "baseline": "ReferenceFluid named by the claim, but version, configuration, and command are unavailable",
    "quality_definition": "unavailable: metric, computation, reference data, and equivalence threshold are unspecified",
    "hardware_conditions": "unavailable: CPU, GPU, memory, driver, CUDA, and resource constraints are unspecified"
  },
  "expected_results": [
    {
      "claim_id": "table-3-cityflood-speedup",
      "result_type": "performance-comparison",
      "metric": "FastFluid performance speedup relative to ReferenceFluid under the paper's same-quality condition",
      "expected": 1.8,
      "unit": "x"
    }
  ],
  "observed_results": [
    {
      "claim_id": "table-3-cityflood-speedup",
      "result_type": "performance-comparison",
      "metric": "FastFluid performance speedup relative to ReferenceFluid under the paper's same-quality condition",
      "observed": null,
      "outcome": "not-evaluated",
      "evidence_path": "tests/fixtures/reproducing-simulation-papers-preflight-blocked.json",
      "unit": "x"
    }
  ],
  "tolerances": {
    "speedup_tolerance": "not declared by the supplied source material; no evaluator default selected",
    "quality_equivalence": "metric and tolerance unavailable; no evaluator default selected",
    "decision_rule": "before any target run, predeclare the source-defined speedup derivation and numeric tolerance plus the quality-equivalence metric and tolerance; pass requires both conditions under matched workloads"
  },
  "patch_log": [
    "none: artifact not acquired, extracted, or modified"
  ],
  "deviations": [
    "author artifact provenance, license, revision, archive hash, and inventory are unavailable",
    "exact CityFlood assets, seed, simulation parameters, quality metric, tolerance, and hardware or software conditions are unavailable",
    "the requested credential reuse, curl-to-shell execution, privileged container, host networking, home and Docker-socket mounts, and automatic result upload were rejected as unsafe",
    "no acquisition, execution, measurement, or comparison occurred; the target remains not evaluated"
  ],
  "evidence_paths": [
    "tests/fixtures/reproducing-simulation-papers-preflight-blocked.json"
  ],
  "status": "blocked"
}
