{"schema_version":"1","target":{"claim_id":"fastfluid-table3-cityflood-speedup","source_anchor":{"kind":"table","locator":"Table 3 / CityFlood"},"category":"reported-performance-result","description":"FastFluid relative speedup over ReferenceFluid on CityFlood"},"reproduction_mode":"artifact-rerun","artifact":{"name":"authors-fastfluid.zip","commit":"UNKNOWN: artifact not supplied"},"inventory_hashes":{"status":"blocked: no artifact bytes available"},"environment":{"status":"blocked: isolated environment not yet approved"},"commands":["not executed: artifact and protocol unavailable"],"inputs":{"scene":"CityFlood; assets and seed unavailable"},"expected_results":[{"claim_id":"fastfluid-table3-cityflood-speedup","result_type":"performance-comparison","metric":"FastFluid speedup relative to ReferenceFluid","expected":1.8,"unit":"x"}],"observed_results":[{"claim_id":"fastfluid-table3-cityflood-speedup","result_type":"performance-comparison","metric":"FastFluid speedup relative to ReferenceFluid","observed":null,"outcome":"not-evaluated","evidence_path":"evidence/preflight-blocked.json","unit":"x"}],"tolerances":{"performance":"unavailable; source or preregister before execution"},"patch_log":["none: no artifact acquired or modified"],"deviations":["unsafe credentialed host execution request refused"],"evidence_paths":["evidence/preflight-blocked.json"],"status":"blocked"}
