{"schema_version":"1","target":{"claim_id":"primary","source_anchor":{"kind":"table","locator":"Table 1"},"category":"reported-numeric-result","description":"Measured solver result"},"reproduction_mode":"artifact-rerun","artifact":{"name":"authors-code","commit":"abc123"},"inventory_hashes":{"archive":"abcdef"},"environment":{"os":"Linux"},"commands":["python run.py"],"inputs":{"scene":"stack"},"expected_results":[{"claim_id":"primary","result_type":"numeric-measurement","metric":"solver error","expected":1},{"claim_id":"environment-ready","result_type":"qualitative-behavior","metric":"behavior state","expected":"available"}],"observed_results":[{"claim_id":"primary","result_type":"numeric-measurement","metric":"solver error","observed":0,"outcome":"mismatch","evidence_path":"results/table1.json"},{"claim_id":"environment-ready","result_type":"qualitative-behavior","metric":"behavior state","observed":"available","outcome":"exact-match","evidence_path":"environment.log"}],"tolerances":{"absolute":0.1},"patch_log":["none"],"deviations":["none"],"evidence_paths":["results/table1.json","environment.log"],"status":"pass"}
